[
  {
    "id": "dates-unknown",
    "name": "Unknown",
    "startYear": 4004,
    "endYear": 2166,
    "era": "BC",
    "color": "#E0E0E0",
    "description": "Creation, Fall, Flood, Tower of Babel"
  },
  {
    "id": "patriarchs",
    "name": "Patriarch",
    "startYear": 2166,
    "endYear": 1876,
    "era": "BC",
    "color": "#FFF9C4",
    "description": "Abraham, Isaac, Jacob"
  },
  {
    "id": "egypt",
    "name": "Sojourn",
    "startYear": 1876,
    "endYear": 1446,
    "era": "BC",
    "color": "#FFCCBC",
    "description": "Israel enslaved in Egypt"
  },
  {
    "id": "wandering",
    "name": "Wandering",
    "startYear": 1446,
    "endYear": 1406,
    "era": "BC",
    "color": "#D7CCC8",
    "description": "Wilderness journey to Promised Land"
  },
  {
    "id": "judges",
    "name": "Conquest/Judges",
    "startYear": 1406,
    "endYear": 1050,
    "era": "BC",
    "color": "#C8E6C9",
    "description": "Conquest of Canaan followed by the era of the judges."
  },
  {
    "id": "united-kingdom",
    "name": "United Monarchy",
    "startYear": 1050,
    "endYear": 930,
    "era": "BC",
    "color": "#BBDEFB",
    "description": "Saul, David, and Solomon ruled a united Israel."
  },
  {
    "id": "divided-kingdom",
    "name": "Divided Monarchy",
    "startYear": 930,
    "endYear": 586,
    "era": "BC",
    "color": "#E1BEE7",
    "description": "The kingdom split into Israel (north, 10 tribes) and Judah (south, 2 tribes). Ended with the fall of both kingdoms."
  },
  {
    "id": "exile",
    "name": "Exile",
    "startYear": 586,
    "endYear": 538,
    "era": "BC",
    "color": "#BDBDBD",
    "description": "Babylonian captivity following the fall of Jerusalem."
  },
  {
    "id": "restoration",
    "name": "Restoration",
    "startYear": 538,
    "endYear": 400,
    "era": "BC",
    "color": "#B0BEC5",
    "description": "Return from exile and rebuilding of temple and covenant life."
  }
]
